{
  "schema_version": "0.1",
  "generated_at": "2026-02-14T18:06:38.038990+00:00",
  "graph_id": "e2e_pic_mzi",
  "provenance": {
    "graph_hash": "3417d95e0edf40b314069061567192e3e4dff84b491c312fe390c9f473591a00",
    "python": "3.12.10",
    "platform": "Windows-11-10.0.26200-SP0"
  },
  "settings": {
    "coord_tol_um": 1e-06
  },
  "expected": {
    "edges": [
      {
        "from": "cpl_in",
        "from_port": "out1",
        "to": "ps1",
        "to_port": "in"
      },
      {
        "from": "cpl_in",
        "from_port": "out2",
        "to": "ps2",
        "to_port": "in"
      },
      {
        "from": "ps1",
        "from_port": "out",
        "to": "cpl_out",
        "to_port": "in1"
      },
      {
        "from": "ps2",
        "from_port": "out",
        "to": "cpl_out",
        "to_port": "in2"
      }
    ],
    "edges_count": 4
  },
  "observed": {
    "edges": [
      {
        "route_id": "e1:cpl_in.out1->ps1.in",
        "a": {
          "node": "cpl_in",
          "port": "out1"
        },
        "b": {
          "node": "ps1",
          "port": "in"
        }
      },
      {
        "route_id": "e2:cpl_in.out2->ps2.in",
        "a": {
          "node": "cpl_in",
          "port": "out2"
        },
        "b": {
          "node": "ps2",
          "port": "in"
        }
      },
      {
        "route_id": "e3:ps1.out->cpl_out.in1",
        "a": {
          "node": "ps1",
          "port": "out"
        },
        "b": {
          "node": "cpl_out",
          "port": "in1"
        }
      },
      {
        "route_id": "e4:ps2.out->cpl_out.in2",
        "a": {
          "node": "ps2",
          "port": "out"
        },
        "b": {
          "node": "cpl_out",
          "port": "in2"
        }
      }
    ],
    "edges_count": 4,
    "dangling_routes": [],
    "warnings": []
  },
  "mismatches": {
    "missing_edges": [],
    "extra_edges": [],
    "port_role_mismatches": [],
    "unconnected_ports": []
  },
  "summary": {
    "pass": true,
    "missing_edges": 0,
    "extra_edges": 0,
    "port_role_mismatches": 0,
    "unconnected_ports": 0
  }
}